{"extraction_point":"false","room_type":"reward","display_name":"High Risk Vault","review_record_id":"review.room.room_variant.machine_silo.high_risk_vault","style_profile_id":"style.zone.machine_silo","optional_path":"true","tutorial_anchor_ids":"anchor.tutorial.high_risk","room_id":"room.raid.high_risk_vault","exit_room_ids":"room.raid.guard_post,room.raid.extraction_pad","high_risk_reward":"true","id":"room_variant.machine_silo.high_risk_vault","feedback_tag_ids":"tag.feedback.reward,tag.feedback.danger","landmark_label":"Red hazard door","companion_hint_anchor_ids":"hint.companion.loot_ping","kit_id":"kit.room.secret.bypass"}
