{"extraction_point":"false","room_type":"optional_loot","display_name":"Salvage Nook","review_record_id":"review.room.room_variant.machine_silo.salvage_nook","style_profile_id":"style.zone.machine_silo","optional_path":"true","tutorial_anchor_ids":"anchor.tutorial.loot","room_id":"room.raid.salvage_nook","exit_room_ids":"room.raid.guard_post","high_risk_reward":"false","id":"room_variant.machine_silo.salvage_nook","feedback_tag_ids":"tag.feedback.reward,tag.feedback.companion_decision","landmark_label":"Orange crate stack","companion_hint_anchor_ids":"hint.companion.rare_loot","kit_id":"kit.room.loot.vault"}
