{"extraction_point":"false","room_type":"shortcut","display_name":"Maintenance Bypass","review_record_id":"review.room.room_variant.sky_docks.maintenance_bypass","style_profile_id":"style.zone.sky_docks","optional_path":"true","tutorial_anchor_ids":"anchor.tutorial.shortcut","room_id":"room.sky.maintenance_bypass","exit_room_ids":"room.sky.launch_pad","high_risk_reward":"false","id":"room_variant.sky_docks.maintenance_bypass","feedback_tag_ids":"tag.feedback.reward,tag.feedback.tutorial","landmark_label":"Hidden service hatch","companion_hint_anchor_ids":"hint.companion.safe_route","kit_id":"kit.room.secret.bypass"}
