{"extraction_point":"false","room_type":"entry","display_name":"Entry Platform","review_record_id":"review.room.room_variant.machine_silo.entry_platform","style_profile_id":"style.zone.machine_silo","optional_path":"false","tutorial_anchor_ids":"anchor.tutorial.mission_start","room_id":"room.raid.entry_platform","exit_room_ids":"room.raid.patrol_hall,room.raid.guard_post","high_risk_reward":"false","id":"room_variant.machine_silo.entry_platform","feedback_tag_ids":"tag.feedback.tutorial","landmark_label":"Blue floodlight","companion_hint_anchor_ids":"hint.companion.entry_cover","kit_id":"kit.room.hub.crossroads"}
