{"extraction_point":"false","room_type":"hub","display_name":"Cargo Crossroads","review_record_id":"review.room.room_variant.sky_docks.cargo_crossroads","style_profile_id":"style.zone.sky_docks","optional_path":"false","tutorial_anchor_ids":"anchor.tutorial.zone_choice","room_id":"room.sky.cargo_crossroads","exit_room_ids":"room.sky.wind_corridor,room.sky.artifact_vault,room.sky.launch_pad","high_risk_reward":"false","id":"room_variant.sky_docks.cargo_crossroads","feedback_tag_ids":"tag.feedback.tutorial","landmark_label":"Cargo lift ring","companion_hint_anchor_ids":"hint.companion.scan_sky","kit_id":"kit.room.hub.crossroads"}
