{"extraction_point":"false","room_type":"traversal","display_name":"Catwalk Run","review_record_id":"review.room.room_variant.relay_tunnels.catwalk_run","style_profile_id":"style.zone.relay_tunnels","optional_path":"false","tutorial_anchor_ids":"anchor.tutorial.traversal","room_id":"room.relay.catwalk_run","exit_room_ids":"room.relay.extraction_lift","high_risk_reward":"false","id":"room_variant.relay_tunnels.catwalk_run","feedback_tag_ids":"tag.feedback.tutorial,tag.feedback.danger","landmark_label":"Coil catwalk","companion_hint_anchor_ids":"hint.companion.scout","kit_id":"kit.room.traversal.catwalk"}
