{"extraction_point":"false","room_type":"corridor","display_name":"Wind Corridor","review_record_id":"review.room.room_variant.sky_docks.wind_corridor","style_profile_id":"style.zone.sky_docks","optional_path":"false","tutorial_anchor_ids":"anchor.tutorial.timed_run","room_id":"room.sky.wind_corridor","exit_room_ids":"room.sky.launch_pad","high_risk_reward":"false","id":"room_variant.sky_docks.wind_corridor","feedback_tag_ids":"tag.feedback.danger","landmark_label":"Open turbine lane","companion_hint_anchor_ids":"hint.companion.cover_lane","kit_id":"kit.room.corridor.narrow"}
