{"extraction_point":"false","room_type":"reward","display_name":"Artifact Vault","review_record_id":"review.room.room_variant.sky_docks.artifact_vault","style_profile_id":"style.zone.sky_docks","optional_path":"false","tutorial_anchor_ids":"anchor.tutorial.artifact","room_id":"room.sky.artifact_vault","exit_room_ids":"room.sky.maintenance_bypass,room.sky.launch_pad","high_risk_reward":"true","id":"room_variant.sky_docks.artifact_vault","feedback_tag_ids":"tag.feedback.reward,tag.feedback.danger","landmark_label":"Hanging signal crate","companion_hint_anchor_ids":"hint.companion.rare_loot","kit_id":"kit.room.loot.vault"}
