{"extraction_point":"false","room_type":"combat","display_name":"Ambush Fork","review_record_id":"review.room.room_variant.relay_tunnels.ambush_fork","style_profile_id":"style.zone.relay_tunnels","optional_path":"false","tutorial_anchor_ids":"anchor.tutorial.revive","room_id":"room.relay.ambush_fork","exit_room_ids":"room.relay.catwalk_run,room.relay.extraction_lift","high_risk_reward":"false","id":"room_variant.relay_tunnels.ambush_fork","feedback_tag_ids":"tag.feedback.danger,tag.feedback.companion_decision","landmark_label":"Split relay mast","companion_hint_anchor_ids":"hint.companion.guardian","kit_id":"kit.room.ambush.killbox"}
