{"extraction_point":"false","room_type":"combat","display_name":"Guard Post","review_record_id":"review.room.room_variant.machine_silo.guard_post","style_profile_id":"style.zone.machine_silo","optional_path":"false","tutorial_anchor_ids":"anchor.tutorial.cover","room_id":"room.raid.guard_post","exit_room_ids":"room.raid.high_risk_vault,room.raid.generator_room,room.raid.extraction_pad","high_risk_reward":"false","id":"room_variant.machine_silo.guard_post","feedback_tag_ids":"tag.feedback.danger,tag.feedback.companion_decision","landmark_label":"Broken console","companion_hint_anchor_ids":"hint.companion.defend_player","kit_id":"kit.room.ambush.killbox"}
