{"extraction_point":"true","room_type":"extraction","display_name":"Extraction Pad","review_record_id":"review.room.room_variant.machine_silo.extraction_pad","style_profile_id":"style.zone.machine_silo","optional_path":"false","tutorial_anchor_ids":"anchor.tutorial.extract","room_id":"room.raid.extraction_pad","exit_room_ids":"","high_risk_reward":"false","id":"room_variant.machine_silo.extraction_pad","feedback_tag_ids":"tag.feedback.extraction,tag.feedback.companion_decision","landmark_label":"Amber beacon","companion_hint_anchor_ids":"hint.companion.extract","kit_id":"kit.room.extraction.pad"}
