{"extraction_point":"false","room_type":"corridor","display_name":"Patrol Hall","review_record_id":"review.room.room_variant.machine_silo.patrol_hall","style_profile_id":"style.zone.machine_silo","optional_path":"false","tutorial_anchor_ids":"anchor.tutorial.first_combat","room_id":"room.raid.patrol_hall","exit_room_ids":"room.raid.salvage_nook,room.raid.guard_post","high_risk_reward":"false","id":"room_variant.machine_silo.patrol_hall","feedback_tag_ids":"tag.feedback.danger,tag.feedback.tutorial","landmark_label":"Pipe arch","companion_hint_anchor_ids":"hint.companion.follow_lane","kit_id":"kit.room.corridor.narrow"}
