{"extraction_point":"false","room_type":"objective","display_name":"Generator Room","review_record_id":"review.room.room_variant.machine_silo.generator_room","style_profile_id":"style.zone.machine_silo","optional_path":"true","tutorial_anchor_ids":"anchor.tutorial.activate_machine","room_id":"room.raid.generator_room","exit_room_ids":"room.raid.extraction_pad","high_risk_reward":"false","id":"room_variant.machine_silo.generator_room","feedback_tag_ids":"tag.feedback.tutorial,tag.feedback.maker_success","landmark_label":"White machine core","companion_hint_anchor_ids":"hint.companion.repair_path","kit_id":"kit.room.traversal.catwalk"}
