{"extraction_point":"true","room_type":"extraction","display_name":"Launch Pad","review_record_id":"review.room.room_variant.sky_docks.launch_pad","style_profile_id":"style.zone.sky_docks","optional_path":"false","tutorial_anchor_ids":"anchor.tutorial.extract_sky","room_id":"room.sky.launch_pad","exit_room_ids":"","high_risk_reward":"false","id":"room_variant.sky_docks.launch_pad","feedback_tag_ids":"tag.feedback.extraction","landmark_label":"Runway beacon","companion_hint_anchor_ids":"hint.companion.extract","kit_id":"kit.room.extraction.pad"}
