{"extraction_point":"false","room_type":"corridor","display_name":"Long Relay Corridor","review_record_id":"review.room.room_variant.relay_tunnels.long_corridor","style_profile_id":"style.zone.relay_tunnels","optional_path":"false","tutorial_anchor_ids":"anchor.tutorial.escort","room_id":"room.relay.long_corridor","exit_room_ids":"room.relay.ambush_fork,room.relay.catwalk_run","high_risk_reward":"false","id":"room_variant.relay_tunnels.long_corridor","feedback_tag_ids":"tag.feedback.danger","landmark_label":"Relay conduit spine","companion_hint_anchor_ids":"hint.companion.stay_close","kit_id":"kit.room.corridor.narrow"}
