{"extraction_point":"true","room_type":"extraction","display_name":"Extraction Lift","review_record_id":"review.room.room_variant.relay_tunnels.extraction_lift","style_profile_id":"style.zone.relay_tunnels","optional_path":"false","tutorial_anchor_ids":"anchor.tutorial.extract_relay","room_id":"room.relay.extraction_lift","exit_room_ids":"","high_risk_reward":"false","id":"room_variant.relay_tunnels.extraction_lift","feedback_tag_ids":"tag.feedback.extraction","landmark_label":"Green lift beacon","companion_hint_anchor_ids":"hint.companion.extract","kit_id":"kit.room.extraction.pad"}
